<?xml version="1.0" encoding="UTF-8"?>
<xs:schema xmlns:xs="http://www.w3.org/2001/XMLSchema">

    <!-- Complex type for a single student -->
    <xs:complexType name="studentType">
        <xs:sequence>
            <xs:element name="regno" type="xs:string"/>
            <xs:element name="name" type="xs:string"/>
            <xs:element name="dept" type="xs:string"/>

            <xs:element name="semester">
                <xs:simpleType>
                    <xs:restriction base="xs:positiveInteger">
                        <xs:minInclusive value="1"/>
                        <xs:maxInclusive value="8"/>
                    </xs:restriction>
                </xs:simpleType>
            </xs:element>

            <xs:element name="email" type="xs:string"/>

            <xs:element name="cgpa">
                <xs:simpleType>
                    <xs:restriction base="xs:decimal">
                        <xs:minInclusive value="0.0"/>
                        <xs:maxInclusive value="10.0"/>
                    </xs:restriction>
                </xs:simpleType>
            </xs:element>
        </xs:sequence>
    </xs:complexType>

    <!-- Root element containing list of students -->
    <xs:element name="students">
        <xs:complexType>
            <xs:sequence>
                <xs:element name="student" type="studentType"
                            minOccurs="1" maxOccurs="unbounded"/>
            </xs:sequence>
        </xs:complexType>
    </xs:element>

</xs:schema>
